{
  "version": "1.0",
  "generated_at": "2026-10-13T09:55:02.577089",
  "schema_version": "2.2",
  "source_thread": "https://forum.level1techs.com/t/256443",
  "total_submissions": 25,
  "skipped_templates": 2,
  "submissions": [
    {
      "id": "post_5_digitalscream_0",
      "source": {
        "post_number": 5,
        "post_id": 4119255,
        "username": "digitalscream",
        "submitted_at": "2026-09-18T14:00:04.030Z"
      },
      "type": "full",
      "raw": {
        "tier": "48-64GB",
        "hardware": "2 x R9700",
        "backend": "vLLM",
        "model_name": "d0xin/Swift-Qwen3.8-27B-Uncensored-FP8",
        "quant_package": "FP8",
        "download_url": "https://huggingface.co/d0xin/Swift-Qwen3.8-27B-Uncensored-FP8",
        "primary_use_case": "Coding, Research (OpenCode)",
        "stable_context_tested": "~240k",
        "kv_cache_setting": "FP16",
        "throughput_tps": "120t/s code, 70t/s chat",
        "setup_notes": "magiccodingman/vllm-radiance, with adaptive MTP = 8"
      },
      "tier": "t4",
      "hardware": {
        "description": "2 x R9700",
        "vendor": "AMD"
      },
      "backend": "vLLM",
      "model": {
        "name": "d0xin/Swift-Qwen3.8-27B-Uncensored-FP8",
        "url": "https://huggingface.co/d0xin/Swift-Qwen3.8-27B-Uncensored-FP8"
      },
      "quant": "FP8",
      "weight_precision": "",
      "use_cases": "Coding, Research (OpenCode)",
      "context": {
        "stable": "~240k",
        "kv_cache": "FP16"
      },
      "performance": {
        "decode_tps": "120t/s code, 70t/s chat",
        "prefill_tps": "",
        "ttft_cold": "",
        "power_w": ""
      },
      "engine_mode": "",
      "notes": "magiccodingman/vllm-radiance, with adaptive MTP = 8",
      "confidence": "community-reported",
      "lifecycle": "current",
      "highlight": false,
      "tags": []
    },
    {
      "id": "post_6_burhan_0",
      "source": {
        "post_number": 6,
        "post_id": 4119262,
        "username": "Burhan",
        "submitted_at": "2026-09-18T14:30:23.937Z"
      },
      "type": "full",
      "raw": {
        "tier": "16-24GB",
        "hardware": "1x RTX-4000 Ada SFF (20 GB)",
        "backend": "Ollama",
        "model_name": "Qwen3.6-27b-q4_KM",
        "quant_package": "GGUF Q4_K_M",
        "download_url": "https://ollama.com/library/qwen3.6:27b-q4_K_M",
        "primary_use_case": "Document Q&A, Deep Research, Brainstorming, Coding",
        "stable_context_tested": "52000",
        "kv_cache_setting": "q8_0",
        "engine_mode": "Hybrid (VRAM+RAM)",
        "throughput_tps": "~20-30 t/s",
        "prefill_tps": "[Prefill tok/s (if measured)]",
        "ttft_cold": "[Seconds for first token after cold load]",
        "power_draw": "75 W",
        "setup_notes": "[Launch flags, rope/yarn config, host RAM offload, prompt prefill behavior, quirks]"
      },
      "tier": "t2",
      "hardware": {
        "description": "1x RTX-4000 Ada SFF (20 GB)",
        "vendor": "NVIDIA"
      },
      "backend": "Ollama",
      "model": {
        "name": "Qwen3.6-27b-q4_KM",
        "url": "https://ollama.com/library/qwen3.6:27b-q4_K_M"
      },
      "quant": "GGUF Q4_K_M",
      "weight_precision": "",
      "use_cases": "Document Q&A, Deep Research, Brainstorming, Coding",
      "context": {
        "stable": "52000",
        "kv_cache": "q8_0"
      },
      "performance": {
        "decode_tps": "~20-30 t/s",
        "prefill_tps": "Prefill tok/s (if measured)",
        "ttft_cold": "Seconds for first token after cold load",
        "power_w": "75 W"
      },
      "engine_mode": "Hybrid (VRAM+RAM)",
      "notes": "Launch flags, rope/yarn config, host RAM offload, prompt prefill behavior, quirks",
      "confidence": "community-reported",
      "lifecycle": "current",
      "highlight": false,
      "tags": []
    },
    {
      "id": "post_6_burhan_1",
      "source": {
        "post_number": 6,
        "post_id": 4119262,
        "username": "Burhan",
        "submitted_at": "2026-09-18T14:30:23.937Z"
      },
      "type": "full",
      "raw": {
        "tier": "16-24GB",
        "hardware": "1x RTX-4000 Ada SFF (20 GB)",
        "backend": "Ollama",
        "model_name": "LFM2.5-thinking:1.2b-q8_0",
        "quant_package": "GGUF Q8_0",
        "download_url": "https://ollama.com/library/lfm2.5-thinking:1.2b-q8_0",
        "primary_use_case": "Q&A, Brainstorming, Complex Tasks",
        "stable_context_tested": "64000",
        "kv_cache_setting": "q8_0",
        "engine_mode": "Hybrid (VRAM+RAM)",
        "throughput_tps": "~35 t/s",
        "prefill_tps": "[Prefill tok/s (if measured)]",
        "ttft_cold": "[Seconds for first token after cold load]",
        "power_draw": "75 W",
        "setup_notes": "[Launch flags, rope/yarn config, host RAM offload, prompt prefill behavior, quirks]"
      },
      "tier": "t2",
      "hardware": {
        "description": "1x RTX-4000 Ada SFF (20 GB)",
        "vendor": "NVIDIA"
      },
      "backend": "Ollama",
      "model": {
        "name": "LFM2.5-thinking:1.2b-q8_0",
        "url": "https://ollama.com/library/lfm2.5-thinking:1.2b-q8_0"
      },
      "quant": "GGUF Q8_0",
      "weight_precision": "",
      "use_cases": "Q&A, Brainstorming, Complex Tasks",
      "context": {
        "stable": "64000",
        "kv_cache": "q8_0"
      },
      "performance": {
        "decode_tps": "~35 t/s",
        "prefill_tps": "Prefill tok/s (if measured)",
        "ttft_cold": "Seconds for first token after cold load",
        "power_w": "75 W"
      },
      "engine_mode": "Hybrid (VRAM+RAM)",
      "notes": "Launch flags, rope/yarn config, host RAM offload, prompt prefill behavior, quirks",
      "confidence": "community-reported",
      "lifecycle": "current",
      "highlight": false,
      "tags": []
    },
    {
      "id": "post_6_burhan_2",
      "source": {
        "post_number": 6,
        "post_id": 4119262,
        "username": "Burhan",
        "submitted_at": "2026-09-18T14:30:23.937Z"
      },
      "type": "full",
      "raw": {
        "tier": "16-24GB",
        "hardware": "1x RTX-4000 Ada SFF (20 GB)",
        "backend": "Ollama",
        "model_name": "Gemma4:26b-a4b-it-mtp-q4_K_M",
        "quant_package": "GGUF Q4_K_M",
        "download_url": "https://ollama.com/library/gemma4:26b-a4b-it-mtp-q4_K_M",
        "primary_use_case": "Document Q&A, Deep Research, Creative Writing",
        "stable_context_tested": "64000",
        "kv_cache_setting": "q8_0",
        "engine_mode": "Hybrid (VRAM+RAM)",
        "throughput_tps": "~25-30 t/s",
        "prefill_tps": "[Prefill tok/s (if measured)]",
        "ttft_cold": "[Seconds for first token after cold load]",
        "power_draw": "75 W",
        "setup_notes": "[Launch flags, rope/yarn config, host RAM offload, prompt prefill behavior, quirks]"
      },
      "tier": "t2",
      "hardware": {
        "description": "1x RTX-4000 Ada SFF (20 GB)",
        "vendor": "NVIDIA"
      },
      "backend": "Ollama",
      "model": {
        "name": "Gemma4:26b-a4b-it-mtp-q4_K_M",
        "url": "https://ollama.com/library/gemma4:26b-a4b-it-mtp-q4_K_M"
      },
      "quant": "GGUF Q4_K_M",
      "weight_precision": "",
      "use_cases": "Document Q&A, Deep Research, Creative Writing",
      "context": {
        "stable": "64000",
        "kv_cache": "q8_0"
      },
      "performance": {
        "decode_tps": "~25-30 t/s",
        "prefill_tps": "Prefill tok/s (if measured)",
        "ttft_cold": "Seconds for first token after cold load",
        "power_w": "75 W"
      },
      "engine_mode": "Hybrid (VRAM+RAM)",
      "notes": "Launch flags, rope/yarn config, host RAM offload, prompt prefill behavior, quirks",
      "confidence": "community-reported",
      "lifecycle": "current",
      "highlight": false,
      "tags": []
    },
    {
      "id": "post_6_burhan_3",
      "source": {
        "post_number": 6,
        "post_id": 4119262,
        "username": "Burhan",
        "submitted_at": "2026-09-18T14:30:23.937Z"
      },
      "type": "full",
      "raw": {
        "tier": "16-24GB",
        "hardware": "1x RTX-4000 Ada SFF (20 GB)",
        "backend": "Ollama",
        "model_name": "Qwen3.5:9b-q8_0",
        "quant_package": "GGUF Q8_0",
        "download_url": "https://ollama.com/library/qwen3.5:9b-q8_0",
        "primary_use_case": "Document Q&A, Deep Research, Creative Writing, Brainstorming, Planning",
        "stable_context_tested": "128000",
        "kv_cache_setting": "q8_0",
        "engine_mode": "Hybrid (VRAM+RAM)",
        "throughput_tps": "~30 t/s",
        "prefill_tps": "[Prefill tok/s (if measured)]",
        "ttft_cold": "[Seconds for first token after cold load]",
        "power_draw": "75 W",
        "setup_notes": "[Launch flags, rope/yarn config, host RAM offload, prompt prefill behavior, quirks]"
      },
      "tier": "t2",
      "hardware": {
        "description": "1x RTX-4000 Ada SFF (20 GB)",
        "vendor": "NVIDIA"
      },
      "backend": "Ollama",
      "model": {
        "name": "Qwen3.5:9b-q8_0",
        "url": "https://ollama.com/library/qwen3.5:9b-q8_0"
      },
      "quant": "GGUF Q8_0",
      "weight_precision": "",
      "use_cases": "Document Q&A, Deep Research, Creative Writing, Brainstorming, Planning",
      "context": {
        "stable": "128000",
        "kv_cache": "q8_0"
      },
      "performance": {
        "decode_tps": "~30 t/s",
        "prefill_tps": "Prefill tok/s (if measured)",
        "ttft_cold": "Seconds for first token after cold load",
        "power_w": "75 W"
      },
      "engine_mode": "Hybrid (VRAM+RAM)",
      "notes": "Launch flags, rope/yarn config, host RAM offload, prompt prefill behavior, quirks",
      "confidence": "community-reported",
      "lifecycle": "current",
      "highlight": false,
      "tags": []
    },
    {
      "id": "post_8_s1ugh34d_0",
      "source": {
        "post_number": 8,
        "post_id": 4119449,